{
  "$id": "https://tokenpilot.dev/schemas/connector-heartbeat.schema.json",
  "$schema": "https://json-schema.org/draft/2020-12/schema",
  "type": "object",
  "properties": {
    "schema_version": {
      "$ref": "#/$defs/__schema0"
    },
    "heartbeat_id": {
      "$ref": "#/$defs/__schema1"
    },
    "sent_at": {
      "$ref": "#/$defs/__schema2"
    },
    "connector": {
      "$ref": "#/$defs/__schema3"
    },
    "capabilities": {
      "$ref": "#/$defs/__schema4"
    },
    "status": {
      "$ref": "#/$defs/__schema5"
    },
    "buffer_depth": {
      "$ref": "#/$defs/__schema6"
    },
    "oldest_event_age_seconds": {
      "$ref": "#/$defs/__schema7"
    },
    "last_successful_upload_at": {
      "$ref": "#/$defs/__schema8"
    }
  },
  "required": [
    "schema_version",
    "heartbeat_id",
    "sent_at",
    "connector",
    "capabilities",
    "status",
    "buffer_depth",
    "oldest_event_age_seconds",
    "last_successful_upload_at"
  ],
  "additionalProperties": false,
  "title": "Connector Heartbeat",
  "description": "Health and durable-buffer state reported by a usage connector.",
  "$defs": {
    "__schema0": {
      "type": "string",
      "const": "2.0"
    },
    "__schema1": {
      "anyOf": [
        {
          "type": "string",
          "pattern": "^[0-9A-HJKMNP-TV-Z]{26}$"
        },
        {
          "type": "string",
          "pattern": "^[0-9a-f]{8}-[0-9a-f]{4}-7[0-9a-f]{3}-[89ab][0-9a-f]{3}-[0-9a-f]{12}$"
        }
      ]
    },
    "__schema2": {
      "type": "string",
      "pattern": "^\\d{4}-\\d{2}-\\d{2}T\\d{2}:\\d{2}:\\d{2}(?:\\.\\d{1,9})?Z$"
    },
    "__schema3": {
      "type": "object",
      "properties": {
        "instance_id": {
          "type": "string",
          "minLength": 1,
          "maxLength": 256
        },
        "name": {
          "type": "string",
          "minLength": 1,
          "maxLength": 120
        },
        "type": {
          "type": "string",
          "enum": [
            "litellm"
          ]
        },
        "version": {
          "type": "string",
          "pattern": "^\\d+\\.\\d+\\.\\d+(?:-[0-9A-Za-z.-]+)?$"
        }
      },
      "required": [
        "instance_id",
        "name",
        "type",
        "version"
      ],
      "additionalProperties": false
    },
    "__schema4": {
      "type": "object",
      "properties": {
        "usage_schema": {
          "type": "string",
          "const": "2.0"
        },
        "application_users": {
          "type": "boolean",
          "const": true
        },
        "privacy_mode": {
          "type": "string",
          "const": "content_free"
        },
        "durable_batch_upload": {
          "type": "boolean",
          "const": true
        }
      },
      "required": [
        "usage_schema",
        "application_users",
        "privacy_mode",
        "durable_batch_upload"
      ],
      "additionalProperties": false
    },
    "__schema5": {
      "type": "string",
      "enum": [
        "healthy",
        "degraded"
      ]
    },
    "__schema6": {
      "type": "integer",
      "minimum": 0,
      "maximum": 9007199254740991
    },
    "__schema7": {
      "anyOf": [
        {
          "type": "number",
          "minimum": 0
        },
        {
          "type": "null"
        }
      ]
    },
    "__schema8": {
      "anyOf": [
        {
          "$ref": "#/$defs/__schema2"
        },
        {
          "type": "null"
        }
      ]
    }
  }
}
